{
  "schema_version": "1.0.0",
  "slide_id": "architecture_generation_test_001",
  "semantic_design_path": "architecture_semantic_design.json",
  "objective": "Explain the complete AI-assisted slide drafting architecture and how free visual generation connects to editable reconstruction.",
  "run_context": {
    "project_name": "AI-assisted slide drafting",
    "organization": "PwC",
    "confidentiality": "Internal",
    "date": "24 August 2026",
    "slide_number": 1
  },
  "chrome_content_proposal": {
    "variant": "content_slide",
    "header": {
      "left_text": "AI-ASSISTED SLIDE DRAFTING",
      "right_text": "PROPOSED ARCHITECTURE"
    },
    "footer": {
      "left_text": "PwC | Internal",
      "center_text": "AI-assisted slide drafting",
      "right_text_format": "24 August 2026  |  {slide_number}"
    }
  },
  "explicit_human_constraints": [
    "Use a five-stage left-to-right process because sequence is part of the authored meaning.",
    "Show Stage 2, Stage 4, and Stage 5 internal branches.",
    "Keep relevant technologies visibly attached to the activities they enable.",
    "Do not generate the configured footer region."
  ],
  "exact_content": {
    "title": "Proposed Architecture for AI-Assisted Slide Drafting",
    "subtitle": "High-quality editable slides can be produced by letting AI freely design within the right semantic and brand context, then systematically translating the generated visual back into clean, reusable PowerPoint objects.",
    "stages": [
      {
        "number": 1,
        "label": "Communication & Semantic Planning",
        "content": [
          "Human communication intent + source information",
          "Determine content structure, relationships, hierarchy and emphasis",
          "Produce layout-agnostic visual intent unless the user explicitly specifies layout"
        ]
      },
      {
        "number": 2,
        "label": "Reference Retrieval",
        "content": [
          "Visual References (Visual Reference Library)",
          "Pictogram / Icon References (Pictogram / Icon Library)",
          "User-Provided Icons (Uploaded assets)",
          "Style Rules (Configured typography, color system and visual conventions)"
        ]
      },
      {
        "number": 3,
        "label": "Visual Generation",
        "content": [
          "GPT Image 2 receives semantic visual intent, visual references, selected assets and style rules",
          "GPT Image 2 determines visual structure, use of supplied assets, creation of new visual elements and final composition",
          "Generated target slide image"
        ]
      },
      {
        "number": 4,
        "label": "Parallel Understanding of the Generated Image",
        "content": [
          "Semantic Mapping (VLM) determines what each rendered element represents and maps known assets",
          "Pixel-Level Measurement (OpenCV + SAM 2) measures positions, boundaries, colors, strokes and text-block geometry"
        ]
      },
      {
        "number": 5,
        "label": "Editable PowerPoint Reconstruction",
        "content": [
          "Known Element Reconstruction uses canonical assets, native PowerPoint objects and the Known Element Library",
          "New / Redesigned Element Reconstruction uses semantic decomposition, standard PowerPoint shapes and connectors, geometry fitting, and raster only when required"
        ]
      }
    ],
    "output_label": "Editable PPTX"
  },
  "fixed_visual_references": [
    {
      "reference_id": "VISUAL_REF_01_SCALED_CLIENT",
      "path": "inputs/visual_references/scaled_for_client.png"
    },
    {
      "reference_id": "VISUAL_REF_02_TIMELINE",
      "path": "inputs/visual_references/timeline_slide.png"
    },
    {
      "reference_id": "VISUAL_REF_03_STEPS",
      "path": "inputs/visual_references/steps_slide.png"
    }
  ],
  "user_provided_assets": [
    {
      "asset_id": "USER_LOGO_OPENAI",
      "semantic_role": "stage_3_openai_provider_logo",
      "dimension_role": "technology_logo",
      "name": "OpenAI logo",
      "description": "Mandatory OpenAI provider identity role for Stage 3. Show a recognizable OpenAI logo placeholder inside its allocated rectangular icon slot beside the GPT Image 2 technology label. The exact canonical SVG will be restored during reconstruction.",
      "canonical_file": "inputs/user_assets/reasoning-provider.svg",
      "attachment_status": "internal_only",
      "generation_attachment_mode": "description_only",
      "required_usage": true,
      "mandatory": true
    },
    {
      "asset_id": "USER_LOGO_OPENCV",
      "semantic_role": "stage_4_opencv_logo",
      "dimension_role": "technology_logo",
      "name": "OpenCV logo",
      "description": "Mandatory OpenCV identity role for Stage 4 Pixel-Level Measurement. Show a recognizable OpenCV logo placeholder inside its allocated rectangular icon slot beside the OpenCV + SAM 2 technology label. The exact canonical SVG will be restored during reconstruction.",
      "canonical_file": "inputs/user_assets/vision-library.svg",
      "attachment_status": "internal_only",
      "generation_attachment_mode": "description_only",
      "required_usage": true,
      "mandatory": true
    },
    {
      "asset_id": "USER_LOGO_POWERPOINT",
      "semantic_role": "editable_pptx_output",
      "dimension_role": "output_icon",
      "name": "Microsoft PowerPoint logo",
      "description": "Mandatory Microsoft PowerPoint identity role for the final editable PPTX output. Show a recognizable PowerPoint placeholder inside its allocated rectangular icon slot. The exact canonical SVG will be restored during reconstruction.",
      "canonical_file": "presentation-output.svg",
      "attachment_status": "internal_only",
      "generation_attachment_mode": "description_only",
      "required_usage": true,
      "mandatory": true
    }
  ]
}
